case_id,domain,scenario,task_type,difficulty,question,context,expected_capability,risk_level
CM-001,Capital Markets,"上市公司拟以现金方式收购一家储能项目公司控制权，请根据交易金额与上市公司最近一期总资产、营业收入、净利润、净资产的比例，判断是否可能构成重大资产重组，并说明应进一步核查哪些文件和程序。",Regulatory Analysis,Hard,"上市公司拟以现金方式收购一家储能项目公司控制权，请根据交易金额与上市公司最近一期总资产、营业收入、净利润、净资产的比例，判断是否可能构成重大资产重组，并说明应进一步核查哪些文件和程序。","交易涉及的标的资产规模、收入和净资产指标接近重大资产重组认定阈值。已提供上市公司最近一期财务报告和标的公司主要财务数据。","理解重大资产重组标准，能计算各项比例并判断适用规则，识别需披露和审议程序。","高"
FD-001,Financial,"目标公司近两年营业收入高速增长，但应收账款比例上升明显。请评估收入真实性与回款异常风险，并列举需要核查的合同、发票、银行流水等材料。",Revenue Verification,Medium,"目标公司近两年营业收入高速增长，但应收账款比例上升明显。请评估收入真实性与回款异常风险，并列举需要核查的合同、发票、银行流水等材料。","提供目标公司销售合同清单、客户名单及近两年财务报表。已知主要客户集中度较高，存在跨期确认收入的嫌疑。","能够通过合同与交易记录验证收入真实性，识别跨期确认、关联交易等风险，并提出核查意见。","中"
FD-002,Financial,"目标公司存货余额较大，部分原材料长期未动用。请评估存货跌价和库龄风险，并说明需要关注哪些账龄分析及减值测试材料。",Inventory Assessment,Medium,"目标公司存货余额较大，部分原材料长期未动用。请评估存货跌价和库龄风险，并说明需要关注哪些账龄分析及减值测试材料。","提供库存台账和近期盘点记录。部分存货入库超过两年，市场价格波动较大。","理解存货跌价准备计提要求，能够根据库龄和市场价格判断减值风险并提出审计程序建议。","中"
LD-001,Legal,"某公司部分股东出资方式为知识产权作价入股，且存在转让历史。请分析股权瑕疵和出资风险，并建议核查股权转让协议、验资报告等文件。",Legal Compliance,Medium,"某公司部分股东出资方式为知识产权作价入股，且存在转让历史。请分析股权瑕疵和出资风险，并建议核查股权转让协议、验资报告等文件。","提供公司章程、股东名册及主要历史股权变更文件。存在早期未完成工商变更的情形。","能够识别股权出资形式合法性问题，审核产权转移手续，评估潜在纠纷风险，并列明核查资料。","中"
MED-001,Medical,"某新药已完成I期临床试验，请解读该试验主要终点和安全性数据，说明结论的局限性，并指出需要开展的后续研究。",Clinical Analysis,Medium,"某新药已完成I期临床试验，请解读该试验主要终点和安全性数据，说明结论的局限性，并指出需要开展的后续研究。","提供试验方案及结果摘要。试验样本量小、随访时间短，尚未开展随机对照。","能够准确解读I期临床试验目的、主要终点指标和安全性数据，指出样本数量和设计局限，并提出后续II期试验建议。","中"